{
  "$schema": "http://json-schema.org/draft-07/schema#",
  "$id": "https://deme.dev/schemas/room.schema.json",
  "title": "Room",
  "description": "A single navigable room/screen. One entity per file, conventionally content/rooms/<id>.json.",
  "type": "object",
  "required": ["id", "type", "name", "hotspots"],
  "properties": {
    "id": { "$ref": "common.schema.json#/definitions/entityId" },
    "type": { "const": "room" },
    "name": { "type": "string", "minLength": 1 },
    "description": { "type": "string" },
    "background": {
      "type": "string",
      "description": "Path to the room's background image asset, relative to the content package root."
    },
    "hotspots": {
      "type": "array",
      "items": { "$ref": "hotspot.schema.json" },
      "default": []
    },
    "walkBox": {
      "description": "The polygon within the room's background image where the player character can walk. Click-to-walk targets outside this polygon are clamped to its nearest edge. Omit for a room with no player movement (e.g. a cutscene-only room).",
      "$ref": "common.schema.json#/definitions/polygonPoints"
    },
    "npcIds": {
      "type": "array",
      "description": "References content/npcs/*.json entities present in this room.",
      "items": { "$ref": "common.schema.json#/definitions/entityId" },
      "default": []
    },
    "itemIds": {
      "type": "array",
      "description": "References content/items/*.json entities initially present in this room (not attached to a specific hotspot).",
      "items": { "$ref": "common.schema.json#/definitions/entityId" },
      "default": []
    },
    "exits": {
      "type": "array",
      "description": "Navigation links from a hotspot in this room to another room.",
      "items": {
        "type": "object",
        "required": ["hotspotId", "targetRoomId"],
        "properties": {
          "hotspotId": {
            "$ref": "common.schema.json#/definitions/entityId",
            "description": "References the id of a hotspot in this room's own hotspots[]."
          },
          "targetRoomId": {
            "$ref": "common.schema.json#/definitions/entityId",
            "description": "References a content/rooms/*.json entity."
          }
        },
        "additionalProperties": false
      },
      "default": []
    }
  },
  "additionalProperties": false
}
